"Scenario_ID","Failure_Chain","Linked_Risk_IDs","Required_Controls","Current_Gate_Position"
"SC-01","Ingest trigger failure -> incomplete processing -> false release confidence","JTS-R-003, JTS-R-012, JTS-R-016, JTS-R-029","PR E2E gate, release-path multi-form validation, transfer SLA","Conditional/Block"
"SC-02","Review-gate ambiguity/deadlock -> unresolved workflow state -> non-deterministic sign-off","JTS-R-001, JTS-R-011, JTS-R-013","Deterministic with-review assertions, production-equivalent approval validation","Block"
"SC-03","Partial state transition or control drift -> inconsistent form state and approvals","JTS-R-002, JTS-R-021, JTS-R-030","Lock transition tests, policy hardening, contract + canary checks","Conditional"
"SC-04","Stale lock and timeout path -> user contention/edit interruption","JTS-R-002, JTS-R-030","Lock-renew design, lock conflict monitoring, UI/session safeguards","Conditional"
"SC-05","OCR/NLP drift -> data integrity degradation -> downstream trust impact","JTS-R-006, JTS-R-030, JTS-R-003","Threshold governance, drift checks, benchmarked release validation","Block"
"SC-06","Bad release with weak rollback/restore proof -> prolonged outage/compliance risk","JTS-R-008, JTS-R-009, JTS-R-015, JTS-R-023","Alarm coverage matrix, restore drills, complete change controls","Block"
"SC-07","Biased planning assumptions -> under-scoped controls -> fat-tail overrun -> pressured release decision","JTS-R-031, JTS-R-032, JTS-R-033","Independent challenge, reference-class forecasting, P80/P95 contingency gates","Block"
"SC-08","Unsigned artifact transport or trust-policy bypass -> compromised release artifact provenance -> unsafe deployment","JTS-R-010, JTS-R-039, JTS-R-038","Signed artifact verification, hard-fail scan/SBOM controls, reproducible build attestations","Block"
"SC-09","Token exposure and non-atomic form updates -> unauthorized/incorrect state transitions -> data integrity failure","JTS-R-034, JTS-R-036, JTS-R-037","Server-side transition API, conditional writes, duplicate transaction guards","Block"
"SC-10","LocalStack bypass or verbose execution payload logging -> skipped control path or sensitive telemetry leakage -> compliance/security incident","JTS-R-040, JTS-R-041, JTS-R-006","Non-local use_localstack hard-fail guards, payload redaction/minimization controls, sensitive-field alerting","Block"
"SC-11","Payload growth and burst load saturation -> workflow failures/backlog buildup -> delayed processing and release instability","JTS-R-043, JTS-R-044, JTS-R-007","Payload budget enforcement, SLO/capacity gates, burst rehearsal with rollback thresholds","Conditional/Block"
